{"attestation_digest":"sha256:07a105656da776738e16aa2d2fa96910575a1e33a38886e1106167723012fbdf","authority_receipt_digest":"sha256:d863869d179317e91f157c695c36fb9d94ec62416370fcf51d8d7ea416647fa9","authorization_digest":"sha256:9cf3beff697d3eb2586bdabfd26c6fbe44070a8210741e7a111bcda93c49b4af","aws_calls":0,"aws_mutations":0,"classification":"SYNTHETIC_VALIDATED","deployment_authorized":false,"evidence_complete":true,"evidence_stable":true,"handoff_digest":"sha256:462891d0a9374007a53b0ce104cf86ba030e2c0d94229a234df36e86e6a92dda","identity_center_receipt_digest":"sha256:6d9eab26d4192c5c0256da46584d332319eca580a29f60a47045a70699b53814","independent_approval_present":false,"live_provider_evidence":false,"policy_digest":"sha256:84c360aa6815e9ec0fcf2d06b65c0880015bf8bf75aa15292a36da60c00f0a68","production_status":"NO-GO","provider_calls":20,"read_only":true,"reconciliation_only":false,"record_type":"scanalyze.platform_authority.gug376_live_readonly_handoff.v1","run_digest":"sha256:4055c9b887c1054103fa54046dc66eb234375b837b7b38e679febca30ba3e116","source_commit_sha":"1111111111111111111111111111111111111111","source_tree_sha":"2222222222222222222222222222222222222222","status":"LIVE_INVENTORY_NOT_PROVEN","transcript_digest":"sha256:72aa7146feecd2374d3889043ee8d8981db23b3f9cb01e6039978ab40280ce48","trust_anchor_digest":"sha256:4425564d40600b30bd8a0dad9c578f4da2597d544ddf592d789f63d43b8393a2","two_human_status":"NOT_PROVEN","window_digest":"sha256:7232aa73c51abe35618ebeff7eb4d43b7739f392e9bbc603d082d2c06cad0ca9"}
